,content
219,"Great app overall. However, the loop function has stopped working. It will play a song twice, and then go to the next song despite me having the one-song loop activated. I go and check the song page, and the loop function is turned off by the second time the song plays. Perhaps a bug?"
220,Dont download this application as it sells users profile and passwords in people who can use it for wrong purposes So bewaree! I have downloaded it and seen it myself.
221,"This app is trying to get access of your personal information from Google or whatever is in cooperation with others. If you deny it, easily no more use of this app. I don't suggest it anymore to people."
222,"Everything works perfectly, except loading times. Otherwise would've been 5 stars Edit: Was amazing when they offered a free plan in South Africa. Same price as Spotify, Spotify works much better"
223,i must pay before i browse your app?? why did y'all ruin deezer for Nigeria?
224,Price is high in the middle east so i am using Anghami as an alternative.. although Deezer is better.
225,App is amazing but for some reason every 30min to an hour the app just shuts off really a bother when you're driving. Other than that 1 glitch it's the perfect app. Music is always out on time everytime
226,Best application ever💜
227,cant control other devices like with Spotify. fix that and will give 5☆
228,"had trouble downloading podcasts, otherwise it's good"
229,no add to queue or play next option
230,really loving Deezer Great Lossless audio quality. 😎
231,A potential competitor for Spotify that deserves a shot
232,try to add more music
233,No free version in my country. So in order to access my previous history I have to subscribe to premium with which I won't do. I'm with Spotify. You've literally destroyed your entire brand by moving away from the free tiers. Won't be back. Made the best decision it appears.
234,"I made a review a few months ago for Deezer which was about the ads but now it's about the playlists. I can't even listen to my music. I want to listen to a playlist but when I hit shuffle play, it comes up with songs that don't exist in my playlist immediately! Just let me listen to my own music! I used to have Deezer Premium too which was expensive to say the least so I may not be getting it again."
235,Happy and smiling
236,This app sucks they really push getting the premium account with video ads and the increasing number of advertisers including the ad for premium it constantly kicks me out for no reason it doesn't give me a reason why it kicked out so I can't screenshot anything and no I'm not going send you a email it's about time to look for a better music app
237,Emily Barker is fantastic . Watch out for UK gigs
238,hi can you please add an update with my favorite song Alexander Stan all my people please
239,So I used to think the app was awesome but over the years its getting progressively worse. Its all small usuability issues that are never addressed. The downloaded music page constantly refreshes when you go into it. You loose your spot and there is always a delay in everything showing. Now when setting albums to download if new songs are added you have to undownload them and then redownload to get the new songs. Plus they raised the pricing recently. For what benefit?
240,It's sucks it's like Spotify but worse
241,"The service is excellent but the app needs to be looked into. It doesn't stop playing music if you close it (you need to manyally pause), sometimes it will fail loading any content and the only way to make it work again is to reboot the app twice, there is no option to download single song (you need to put them on a playlist to download), half of the recommendations in the home page have nothing to do with the users tastes (from highlights downwards it's all useless)"
242,love this app
243,Best music app I've come across yet!!
244,"good app, however it crashes a lot and takes long to read downloaded content if internet is not so good."
245,"App is frustratingly slow. It takes 10 seconds to load any section. My network speed is good, and even download songs at 5mbps, so the problem is in the app or deezer servers. I regret paying a year subscription as the app is becoming worse each time. I will move to another service asap"
246,It's good can't lie
247,"Latest update removes the ability to use the sleep timer with AI generated playlists (Flow), this is an essential feature for me! Please bring it back!"
248,Syncing the app between devices doesn't work. The slider shows the last known place but just gets stuck not playing anything. I can only restart & play podcast from the beginning
249,"Used to be excellent. Now you can't access your downloaded or favorited music offline which kinda defeats the whole purpose. I'm a premium subscriber but I'll be cancelling, sadly as my playlist is about 5 years old."
250,"I give it 5 stars (and bought an annual subscription) because I truly believe Deezer is the best overall streaming service available. I just wish it didn't feel so sluggish compared to Spotify/Apple Music, and especially when compared to Tidal."
251,"Plz fix your app do you do testing after updates? Its a new bug everytime this time theres 2, forst one when i click on the deezer app its loading the webpage instead pf the app why? And number 2 when im connected to a bluetooth speaker if of get any kind of notification the musoc mutes itself until i go back on the app and then it carries on playing the same part of the song over and over fix your dam app or im getting spotify instead you got 1 week"
252,Very marginal podcast inventory
253,Awesome
254,not the best i have paid non stop and keeps reminding me to pay really!!!! sort it out
255,"Many small bugs that, in term, hinder user experience. Random tracks that get a popup ""unable to load"" and then work fine by clicking retry, playlists playing in reverse order, different artists sharing the same profile, artists with 2 fans making it to some of the top charts playlists (how ? Nobody heard of them, check for your app security) and probably more that I forgot. The app would be much better without all these small but annoying isssues."
256,"Very good. Like the sound quality. It is better than Spotify premiums quality. But there is certainly songs it hasn't got, which Spotify has. The reason for the 4/5. It's little more expensive than I like, but the extra price is worth it for better audio. So far, mostly pleased. I'll give it another month to see what the music 🎵 recommend feature is like. Spotify song recommendations is amazing. I hope Deezers is too. Tuesday 6th June 2023. I've updated to 5 Star. Music recommendation 5/5."
257,I like the catalog of music that they have.
258,I found almost everything I have searched for. Definitely the best music app 👌
259,Deezer is the best for HiFi Music and Podcasts
260,It crush to often
261,"Even this 1 star is way too much! Don't be so greedy! Let the people listen to some music for free! Anything we want, not just something you think we want to listen. This app is all about Premium these days as in subscription-based model and that's never a good thing. It's all about the money now, NOT the music! Music comes second in this app. Why not making it a one-time purchase model instead? That would be so much better. Nobody likes subscriptions! That goes for me too."
262,Estatic
263,YouTube Music the best ⭐⭐⭐⭐⭐🤗!!!
264,Works great 😃
265,the best music streaming app I've found. I've tried Spotify and other the ability to link to devices moderately easier nothing half a good as deezer
266,true hifi sound not like spotify
267,It's great but a lot of songs are still not on it like the other streaming platforms.
268,ìp
269,Good
270,"Waaaaayyyy better than Amazon prime music unlimited, sound, control, support, value."
271,music unlocked 🔓😭 music galore
272,Not affordable.
273,"Four stars for now, because when looking for a song it wants you to type the exact song name and artist, which is quite difficult when you don't remember the song and actually need help from Deezer to locate the song. 🙂"
274,this guy is out of the curve! rock and roll
275,"Haven't used since 2019, thought id have another look. First thing is that you have to answer if you are male, female or non binary, what has that got to do with you... then it insists you choose 3 artists, to personalise my content... i don't want personalised content, can't move forward unless i choose 3, can't even delete account until you have chosen 3, so choose 500 then managed to delete the account."
276,Amazing
277,H d's I think 🤔 😳
278,Cool!
279,great and inspirational words
280,"Advertised on Google that they had a specific artist that I was looking for, but they don't."
281,Flac quality is unbeatable and blows the competition at this price point.
282,l'appli s'arrête toute seule après 3 chansons...
283,🌟🌟🌟🌟🌟
284,Best ever
285,"NAO PERCAM SEU TEMPO COM ESSE LIXO. Deezer é um lixo. Não importa se está usando Wifi ou 4G, leva 3 horas pra carregar uma única musica na pesquisa, msm consumindo 30GB da memória do meu telefone. Deezer is worse and worse. Thinking seriously about replacing it with Spotify. Deezer takes a lifespan and a half to load the content you search meanwhile on YouTube app, which I haven't even subscribed in, it happens in a snap."
286,ótimo!!
287,No way to change password or cancel account
288,Deezers got me down cold. Yo love it!
289,Only good when you pay for it what I mean is downloaded a bunch of songs and soon as the trial was over so is your play list might have continued but it's all about the money with every one anymore and that's just wrong and you use my data and I can't take that back or charge you all wow really wrong .
290,"It's a pretty good service and has a very nice app. But if the internet connection is anything less than perfect nothing will play, even downloaded playlists will just get stuck loading infinitely."
291,Giood.c
292,Gay
293,keeps stopping
294,Very clear instructions
295,"In general, great app, best amount of music a man can get, I have the premium although the widget isn't working the song catcher, flow and play aren't working properly which is why I'm rating 3 stars, guys, fix this up will you, once things are orderly be sure I will rate the app 5 stars, although my 5 doesn't mean much 🤣🤣🤣"
296,like Spotify but for audiophiles. selection isn't quite as good but those crisp highs and tonal lows in my headphones more than make up for it.
297,The most buggy streaming service I have ever tried besides Tidal. Spotify I'm coming back!!!
298,This app is missing an essential feature that Spotify nails: being able to use the app to control Deezer running on other devices.
299,"-have been using free version for about 5 years now, still love it! -3 years later, i still feel the same way! so eight years i have been with deezer. . .which started out being muve music, free with your cricket phone service. have been with metro pcs for years now, but deezer is connected to my google or my facebook (or both) so my playlists and favorite songs are all still with me!!! super awesome app -10 years now! still love my deezer music app 💖 great service!"
300,"Does not work and have no way to cancel subscription As suggested by your support system, followed the link and I am back where i started. No way of accessing information. When i try to open the deezer app, i am told i do not have an account. However an amount is deductedeach month for a subscription ."
301,Simply the best.
302,Not free
303,"Since a few months, you can't quickly remove a lot of songs from the queue by swiping. Now you always have to wait for the ""undo' prompt to disappear until you can remove the next song in the queue by swiping. Really annoying, especially since this used to work quickly before."
304,Sad
305,"I'm so happy that I discovered Deezer. Believe me I've tried them all. In fact I'm so happy that I'm prepared to start paying my subscription on the 5th of June already when I get paid, instead of when my free trail ends."
306,ok very good music
307,"The app is very good. I mean, the quality of the audio is just great! But on the performance side, it can do better. Sometimes it takes a while to start playing even the songs that already downloaded, or when you click in a song that is in the search tab, the song doesn't play, I have to go to options and click in play next. My point is: There are some bugs that need to be fixed and the app needs to be faster and more fluid (dynamic) to use."
308,"Dear Deezer, can you please fix the Flow algorithm (if there is any)? If I happen to have listened to a some French music before I turn to Flow, all the Flow songs are French, no matter if I choose different ""moods"" (Party, Chill,..). The same happens if I happen to have been listening to some Brazilian music, or in the case this evening all Flow is Flemish music, on all moods. I expect Flow to be a genuine random mix of music and also different music when I select different moods. Thank you."
309,Still plays song in reverse order & repeats shuffles! Terrible app
310,Music 10/10 you get can follow your favourite songs and artists
311,They steal your money for nothing
312,"2 star for price, if was less expense worth 4 star, useless for notstop playing songs, only few tracks on repeat, need search, flow inst flow, is stop after time, same tracks, spotify pee on u, almost and tidal."
313,I did that now & it worked thank you very much for the answer
314,The amount paid for commercial free listening is not worth it. I have been using the app for several years now and I am not happy with it anymore. On top of it stopping music mid song it is displayed a complete different song and artist.... Sorry but I'm unable to make a complaint through the email you provided me. Please try and fix these issues ASAP!
315,"Not as reliable as other music apps, but having flac quality and paying more to artists is the way to do it!"
316,Wonderful to use
317,Very good has all your favourite artists very good designs
318,Y'all need to get rid of commercials and more music and shuffle button and stop asking music I didn't request it keeps stopping
319,I enjoy the Sound quality.
320,Interface is really good. Has excellent content on African music
321,best app !
322,Free service is no longer offered but this app remain preinstalled and cannot be removed.
323,thanks for the subscription its abgood app.
324,Better than Pandora
325,Deezer has the same high quality sound then Amazon Music so I quit Amazon Music due to the app running slow and stopping so I perfer to use Deezer
326,not available in our country so ....
327,Deezer is the Bomb my number 1 streaming music app. Great variety and sound performance witout glitching. Deezer The Best #1
328,I love it I ain't found a song it's denied ame of playing
329,getting better at it I Love your get down
330,excellent 👍
331,This is the best one.
332,Awesome!!!!
333,"Play Flow is (was!) *the* main reason to like Deezer over Spotify - and they broke it. Home screen shortcuts don't work. Songcatcher and Play Flow still appear when I long-tap on the app, but both give an error ""App is not installed"". The app is installed, opens with no problem, shows my favourites, playlists etc same as ever. I'm on v. 7.0.29.67 ie the latest version; looks like this 15/5/2023 update ruined Deezer for me."
334,Won't allow me to subscribe because I'm not from white person country.
335,"Discographies are poorly laid out. There needs to be a new section under an artist that contains main album releases. To many popular artists (dead or alive) have so many anniversary, special editions, live, platinum, re-release, remastered, re-re-release etc it turns discographies into a nightmare. Just have section devoted to proper album releases."
336,Family and profiles or accounts as members. Also it was easier to get my Spotify playlists here than to another Spotify account. I hope the rest will be as good as this very promising start.
337,"Excellent, runs without it open."
338,"I love this app, have had it since it was introduced to me by Cricket. I've been able to add so many anime and A-Pop songs to my various playlists. Although, some songs disappear over time for one reason or another, I have no complaints. Now my song catcher will not work, and has not worked in weeks. My internet connection is strong, yet that is the error message I get. Please fix. This is my source for new anime and asian music and artists."
339,"It's a decent service even when free, the sponsored song gets very repetitive though as they only have one at a time but sometimes you don't even hear it. Annoyingly though they have got rid of the widget on the home lock screen so you have to physically go into your phone to skip a track which is not ideal"
340,Not available in Philippines sucks.. no free version ultra sucks
341,pretty goooood
342,My information has been found on the dark web source coming from deezer and you wont let me delete my account and if i get hacked because i cant delete this account and lose all connection to this dark web hack your gonna have a lawsuit a HUGE ONE YOU BET YOUR BUTT YOU WILL
343,"The app crashes more often than not and has problems when queing large amount of songs. Lots of other small tweaks that could make the experience smoother, but it gets the job done and more impirtantly you can play flac's through it."
344,"I love the high sound quality provided for tracks, as well as the functionality of creating and editing playlists. Phenomenal music app."
345,"Just incredible cubs, not free Estonia and many many countries.. Anyway, don't send those bastards a red penny too! USE TORRENT OR ANY FREE APP"
346,"It's one of the best music services, but having a lot of obscure artist mixed really start to annoy me, like for example camellia has a top song that isn't from he, this was a problem with Spotify but apparently they fixed it having a way for artist to block they're name."
347,"Love this app. I have been using it for quite a few months. Sound quality is amazing on premium. I migrated from Spotify premium deezer has way clearer audio. But recently, my playlist has been playing backwards. If I start at the top of my Playlist it only plays one song. If I start at the bottom, then it plays all the songs but backwards. As in oldest song first. Please fix this or allow a setting to be made for us to manually switch the direction of the playlist. Please fix."
348,"Absolutely trash, they keep playing random music during the playlist I created. Do not use on mobile they think they are smarter than you with they dogs1ht recommendation algorithm."
349,The best streaming system I 've I have used yet &I have been streaming music for 12 years just the best yet.
350,"Better than Tidal, YouTube Muisc, and Amazon Music, IMO. I love the UI and the quality of hifi. I don't run into any issues using this, and it seems to get better every update. The flow option is cool too it's catered to your taste so the more music you like the better."
351,Good app
352,I did have this sit but for some reason it was not uploading what I wanted to play so ended up taking off my phone
353,"This would be a great app if the ""Normalize Volume"" option wasn't broken"
354,Very good
355,Love the app
356,liked track list could be better
357,"randomly shuts off while playing music. free version sucks, plays suggested songs instead of songs in the actual playlist. ""for you"" playlists feel like random artists that dont belong together."
358,"Straight up Garbage, not much else to say"
359,It's very nice app. There are a lot of musician from around the world. It good listen to song while cycling or jogging. Some track has lyrics can read to know the words. One thing I don't like it is can't download the music.
360,"Absolutely love this app!! It's the best app I've found for music so far! And they make the best playlist, perfectly fit for you♥️ I'm in love with this app for real😍💯"
361,"Hope you like covers and belligerent devices. Will just make up songs ""ok playing 'something you definitely did not say' on deezer"" And even when it gets the song right it's 99% chance of being a terrible cover version."
362,"Fix bugs and optimize this app. It's almost a disaster! Spotify is smooth with close to zero bugs, but this app have 5-10 bugs and slower in certain moments. Code need to be optimized guys!"
363,very good
364,"The app is Broken, i go to play my favorites and the playback stops from an error saying only one instance of your account can be playing music at a time. But im only using my phone. And it changed my playlist to a completely different and Random artist song que for i have no idea why it just changes what im listening too like a ghost went and pulled a song from the internet randomly , i think im being hacked or something fishy is going on. Every time i use it this happenes. Song plays n stops👎"
365,Best sounding Hi-Fi music out of the Hi-Fi apps available in my opinion.
366,best app for music!!
367,Love Deezer
368,Ok
369,Thanks for deleting my review 🤣 as I said they don't always 100% stick to their offers I'd be careful much cheaper alternatives to music apps than this.
370,Can't login....pliiz help......
371,"Way To Many Ad's !!,, Great Application Deezer Is Great 👍🏻 ⭐ ✌🏻"
372,So you guys fixed the problem about olaying music offline But now poweramp equalizer is not working on deezer so please let users to use any equalizer on the app!!!
373,"Still bugged EQ Been using Deezer for many years now. Unfortunately the entire time they haven't had a working EQ. Works for one track only, the moment you change track the EQ settings are lost. Tested on too many devices to count as I'm a long time user. You'd think they'd have fixed it by now. Offering HQ audio yet won't let you tailor it to your audio device without having to do it for every single song!!! Check if the EQ works once you change track, it won't"
374,Sleep timer stopped working since last update. Unable to fix.
375,O meu flow não muda há dias
376,"I quit Spotify and went through a whole year of trying different streaming services (Tidal, Apple Music, Qobuz, YouTube Music, etc.). At the end, I chose Deezer. The interface was easy and intuitive. The artist recommendations were the best of all the services. Best of all, the artists get a larger share of the money than Spotify and some of the other services."
377,Why am I paying 11.99 for an app that glitches with every search and skips like I'm playing a CD in the 90s???
378,I canceled this program and uninstalled it but they still took money from my account.
379,Love it
380,Best flow and music app that recognises even the most eclectic tastes in music (such as my own).
381,It's just as good as spropfi
382,Unable to try app. The app does nothing when I select confirm on age verification. Have tried removing and installing App. The confirmation icon just spins for a moment when I input my age and select it.
383,The app has a couple of bugs but overall a great music experience.
384,Serenity in vibrations
385,Very high music quality 😘
386,"I used to use this App very much, Now since last update when I try to play a song it stop at the middle of if"
387,Deezermynuts
388,Help me with jams
389,love non stop tunes
390,M segmqm7 .
391,UPDATED: The customer service for this app is HORRIFIC. Been using this app since Cricket discontinued Muve Music almost 10 years ago. Been paying for it from the same bank for the same amount of time. I switched to a different debit card 2 days ago (same bank) & Deezer's payment processor won't accept the payment. They keep emailing me blaming my bank but I have confirmed REPEATEDLY that my bank NEVER RECEIVED A TRANSACTION FROM THEM to begin with! Deezer's in France & has no phone# to call.
392,love this app
393,It's not free
394,modeil
395,love it and has almost every song I can think of
396,"Hi, I'm on the family plan and the app just kidded all of us out and won't allow us to log back in. What seems to be the problem?"
397,"These days, I'm getting annoyed by the app it's full of bugs and stops for no reason sometimes. I keep updating by nothing changes. Please bring back the old deezer. What's up with the new update. Why are my albums and playlists not arranged in grid form."
398,app not opening up says API required
399,I really enjoy Deezer the sound quality is top notch this app is definitely a one of the best music apps around I will definitely recommend it to my friends
